{
  "id": "SWSEC-OS-WINPRIV",
  "name": "Windows Privilege Escalation",
  "domain": "software-security",
  "category": "OS Internals & Exploitation",
  "status": "active",
  "description": "Identification and exploitation of privilege escalation vectors in Windows operating systems. Covers service misconfigurations, unquoted service paths, DLL hijacking, token manipulation, UAC bypass and kernel exploits. Focuses on root-cause analysis and research-depth exploitation; operational escalation during engagements belongs to NETSEC-POST-PRIVESC and credential access to NETSEC-POST-CREDHARVEST.",

  "requires": [
    "FOUND-ETHICS"
  ],
  "recommended": [
    "SWSEC-OS-KERNEL",
    "FOUND-REPORT",
    "NETSEC-POST-PRIVESC",
    "FOUND-TOOLS"
  ],

  "proficiency": {
    "0": {
      "label": "None",
      "description": "No exposure to Windows privilege escalation"
    },
    "1": {
      "label": "Awareness",
      "description": "Understands Windows security model and common privilege escalation concepts",
      "evidence": [
        "Can explain Windows access tokens, integrity levels, and UAC",
        "Understands service accounts, scheduled tasks, and registry-based persistence",
        "Completed introductory training on Windows privilege escalation"
      ]
    },
    "2": {
      "label": "Guided Practice",
      "description": "Identifies basic Windows privesc vectors under supervision using enumeration tools",
      "evidence": [
        "Used WinPEAS, PowerUp, or similar tools to enumerate privesc vectors",
        "Exploited basic service misconfigurations and unquoted paths in lab environments",
        "Performed supervised privesc testing on at least 2 engagements",
        "Work reviewed by authorized tester"
      ]
    },
    "3": {
      "label": "Independent Practice",
      "description": "Independently identifies and exploits Windows privilege escalation vectors",
      "evidence": [
        "Independently achieved privilege escalation on 5+ engagements",
        "Exploits DLL hijacking, service misconfigurations, and token impersonation",
        "Understands and tests AlwaysInstallElevated, SeImpersonate, and similar privilege paths",
        "Passed proficiency assessment on Windows privilege escalation"
      ],
      "authorization": true
    },
    "4": {
      "label": "Advanced / Mentor",
      "description": "Exploits complex Windows environments; chains multiple vectors",
      "evidence": [
        "Chains multiple low-severity issues into privilege escalation paths",
        "Exploits NTLM relay, Kerberos delegation, and DPAPI for credential access",
        "Develops custom tooling for Windows enumeration and exploitation",
        "Reviews and mentors junior testers on Windows privesc findings"
      ],
      "authorization": true
    },
    "5": {
      "label": "Expert / Authority",
      "description": "Authority on Windows internals and privilege escalation; discovers novel vectors",
      "evidence": [
        "Published research or CVEs related to Windows privilege escalation",
        "Developed lab methodology for Windows privilege escalation testing",
        "Discovers novel escalation paths in current Windows releases",
        "Trains teams on Windows internals and exploitation"
      ],
      "authorization": true
    }
  },

  "assessment_methods": [
    {
      "type": "controlled_exercise",
      "description": "Escalate privileges from a low-privilege user to SYSTEM on a prepared Windows host with multiple escalation paths"
    },
    {
      "type": "work_product_review",
      "description": "Review of privilege escalation findings and impact documentation from recent engagements"
    }
  ],

  "framework_mappings": {
    "mitre_attack": {"techniques": ["T1068", "T1574.001", "T1574.009", "T1134", "T1548.002"]},
    "nice": {
      "tks": ["K0744", "K0752", "S0606", "S0839"],
      "work_roles": ["PD-WRL-007 Vulnerability Analysis"]
    }
  },

  "tags": [
    "windows",
    "privilege-escalation",
    "operating-system",
    "post-exploitation",
    "kerberos",
    "kernel",
    "persistence",
    "active-directory",
    "ntlm"
  ]
}
