{
  "id": "NETSEC-EXPLOIT-SVCEXPLOIT",
  "name": "Network Service Exploitation",
  "domain": "network-security",
  "category": "Exploitation",
  "status": "active",
  "description": "Ability to identify and exploit vulnerabilities in network services. Covers vulnerability identification from enumeration data, exploit selection and modification, use of exploitation frameworks (Metasploit, manual exploits), payload selection, and reliable exploitation of remote services.",

  "requires": [
    "NETSEC-RECON-FINGERPRINTING"
  ],
  "recommended": [
    "NETSEC-ENUM-SMB",
    "FOUND-RISK",
    "FOUND-ETHICS",
    "FOUND-TOOLS"
  ],

  "proficiency": {
    "0": {
      "label": "None",
      "description": "No exposure to network service exploitation"
    },
    "1": {
      "label": "Awareness",
      "description": "Understands the concept of exploiting network services and common vulnerability classes",
      "evidence": [
        "Can explain common service vulnerability types (buffer overflows, RCE, deserialization)",
        "Understands the relationship between service versions and known vulnerabilities",
        "Knows the purpose of exploitation frameworks like Metasploit"
      ]
    },
    "2": {
      "label": "Guided Practice",
      "description": "Runs known exploits against vulnerable services under supervision",
      "evidence": [
        "Uses Metasploit to exploit known vulnerabilities on lab targets",
        "Searches exploit databases (exploit-db, CVE) to find applicable exploits",
        "Selects appropriate payloads for the target environment",
        "Documents exploitation steps and results under review"
      ]
    },
    "3": {
      "label": "Independent Practice",
      "description": "Independently identifies exploitable services and achieves reliable exploitation",
      "evidence": [
        "Correlates enumeration data with vulnerability intelligence to identify targets",
        "Modifies public exploits for specific target environments",
        "Achieves reliable exploitation while minimizing service disruption",
        "Documents exploitation chain with full reproducibility for reporting"
      ],
      "authorization": true
    },
    "4": {
      "label": "Advanced / Mentor",
      "description": "Exploits complex and hardened services; develops custom exploits; mentors others",
      "evidence": [
        "Develops custom exploits for services without public exploit code",
        "Bypasses exploit mitigations (ASLR, DEP, stack canaries) in network services",
        "Chains multiple vulnerabilities for exploitation in hardened environments",
        "Mentors junior staff on exploit selection, modification, and safe execution"
      ],
      "authorization": true
    },
    "5": {
      "label": "Expert / Authority",
      "description": "Defines exploitation methodology; discovers zero-day vulnerabilities; trains teams",
      "evidence": [
        "Discovers and responsibly discloses zero-day vulnerabilities in network services",
        "Authored the lab's network exploitation methodology and safe-exploitation guidelines",
        "Published CVEs or exploit research for network service vulnerabilities",
        "Trains teams on exploitation techniques and exploit development"
      ],
      "authorization": true
    }
  },

  "assessment_methods": [
    {
      "type": "controlled_exercise",
      "description": "Given a lab environment with multiple vulnerable services, identify and exploit at least three services to obtain remote access"
    },
    {
      "type": "work_product_review",
      "description": "Review exploitation documentation from recent engagements for methodology, safety, and reproducibility"
    }
  ],

  "framework_mappings": {
    "mitre_attack": {
      "techniques": ["T1210"]
    },
    "nice": {
      "tks": ["K1085", "K1023", "K0752", "S0737", "S0839"],
      "work_roles": ["PD-WRL-007 Vulnerability Analysis"]
    },
    "crest": {
      "areas": ["vulnerability-exploitation"]
    }
  },

  "tags": [
    "exploitation",
    "metasploit",
    "rce",
    "vulnerability",
    "network-services"
  ]
}
